Sheet: Sheet1
C2: Bill of Materials (WIP) | I2: Plantb0t Rev A.2 | L2: MCP4017
C6: Part Details | D6: Part Number | E6: # | F6: PP100U | G6: Price | I6: Datasheet
C7: ESP-12 SOM | D7: ESP8266MOD | E7: 1 | F7: 1.53 | G7: of:=[.F7]*[.E7] -> 1.53
C8: USB Bridge Chip | D8: CP2102 | F8: 1.2 | G8: of:=[.F8]*[.E8] -> 0 | I8: http://www.farnell.com/datasheets/1694195.pdf
C9: PWR Management MCU | D9: ATTINY10-TS8R | F9: 0.49 | G9: of:=[.F9]*[.E9] -> 0 | I9: http://www.farnell.com/datasheets/1693888.pdf
C11: Constant Current Source | D11: PSSI2021SAY | E11: 1 | F11: 0.35 | G11: of:=[.F11]*[.E11] -> 0.35 | I11: http://www.farnell.com/datasheets/667515.pdf
C12: Sensor Power MOSFETs | D12: FC6946010R | E12: 1 | F12: 0.0413 | G12: of:=[.F12]*[.E12] -> 0.0413 | I12: http://www.farnell.com/datasheets/2019093.pdf
C13: Amplifier OpAmp
C14: Analog MUX | D14: 74HC4051PW,118 | E14: 1 | F14: 0.25 | G14: of:=[.F14]*[.E14] -> 0.25 | I14: http://www.farnell.com/datasheets/1645588.pdf
C15: I²C 8-bit I/O Expander | D15: FXL6408UMX | E15: 1 | F15: 0.58 | G15: of:=[.F15]*[.E15] -> 0.58 | I15: https://www.fairchildsemi.com/datasheets/FX/FXL6408.pdf
C16: Voltage Regulator | D16: MCP1825S-1202E/DB | E16: 1 | F16: 0.35 | G16: of:=[.F16]*[.E16] -> 0.35 | I16: http://www.farnell.com/datasheets/514217.pdf
C17: Red Status LED | D17: KPT-3216EC | E17: 4 | F17: 0.06 | G17: of:=[.F17]*[.E17] -> 0.24 | I17: http://www.farnell.com/datasheets/2045822.pdf
C18: RGB Status LED | D18: SML-522MU8WT86 | E18: 1 | F18: 0.09 | G18: of:=[.F18]*[.E18] -> 0.09 | I18: http://www.farnell.com/datasheets/1996295.pdf
C20: 4.7µF Capacitor | D20: MCVVT035M4R7CA1L | E20: 2 | F20: 0.05 | G20: of:=[.F20]*[.E20] -> 0.1 | I20: http://www.farnell.com/datasheets/2151198.pdf
C21: 5.1V Zener Diode | D21: BZT52H | F21: 0.018 | G21: of:=[.F21]*[.E21] -> 0 | I21: http://www.farnell.com/datasheets/954062.pdf
C25: Total | G25: of:=SUM([.G7:.G23]) -> 3.5313
C27: Optional Parts
C30: Environmental Sensor | D30: BME280 | E30: 1 | F30: 5.57 | G30: of:=[.F30]*[.E30] -> 5.57
C37: Parts | D37: Price
C82: Resistor List
C83: 100K | D83: 1
C84: 220 | D84: 7
C85: 10K | D85: 3
C87: Capacitor List
C88: 0.1µF | D88: 7
C89: 4.7µF | D89: 2